{
  "schema_version": "1.0",
  "batch_id": "batch-example-0001",
  "batch_sequence": 0,
  "session_id": "session-example-001",
  "video_id": "mcm-lookbook-example-v1",
  "events": [
    {
      "schema_version": "1.0",
      "session_id": "session-example-001",
      "event_id": "expression-example-0001",
      "sequence": 2,
      "frame_id": "frame-00421",
      "captured_at_mono_ms": 143220.4,
      "video_id": "mcm-lookbook-example-v1",
      "video_time_ms": 4200,
      "playback_epoch": 0,
      "producer_id": "fake-face-adapter",
      "model_revision": "fixture-revision",
      "taxonomy_version": "example-taxonomy-v0",
      "face_detected": true,
      "face_count": 1,
      "scores": {
        "unknown": 0.58
      },
      "quality": 0.79,
      "valid": true,
      "confidence": 0.82,
      "reason": null
    },
    {
      "schema_version": "1.0",
      "session_id": "session-example-001",
      "event_id": "attention-example-0001",
      "sequence": 3,
      "frame_id": "frame-00421",
      "captured_at_mono_ms": 143220.4,
      "video_id": "mcm-lookbook-example-v1",
      "video_time_ms": 4200,
      "playback_epoch": 0,
      "producer_id": "aoi-mapper-v1",
      "model_revision": "fixture-revision",
      "manifest_version": "example-1.0",
      "source_gaze_event_id": "gaze-example-0001",
      "outside_video": false,
      "video_x_norm": 0.3,
      "video_y_norm": 0.46,
      "candidates": [
        {
          "exposure_id": "scene-01-product-01",
          "product_id": "P001",
          "priority": 0
        }
      ],
      "valid": true,
      "confidence": 0.88,
      "reason": null
    }
  ]
}
